{
  "profileId": "new-organization",
  "organizationName": "New Organization Name",
  "organizationType": "SACCO | School | Hospital | NGO | Church | Small Business | University",
  "brand": {
    "primaryColor": "#000000",
    "secondaryColor": "#FFFFFF",
    "backgroundColor": "#FFFFFF",
    "fontFamily": "Inter, Arial, sans-serif",
    "logoPath": "assets/brand/new-organization-logo.png",
    "tagline": "Short brand promise"
  },
  "contact": {
    "phone": "+254 XXX XXX XXX",
    "email": "info@example.com",
    "website": "https://example.com",
    "location": "Kenya"
  },
  "audiences": [],
  "channels": [],
  "toneOfVoice": [],
  "marketingRules": [],
  "approvalWorkflow": [
    "Draft",
    "Review",
    "Approve",
    "Publish",
    "Measure"
  ],
  "analyticsGoals": []
}

